{
  "schema_version": "6.16",
  "scan_metadata": {"ecosystem":"java","root_module":"com.app:app","tool_name":"crypto-finder","tool_version":"dev","exported_at":"2026-10-01T09:35:15Z","function_count":1,"edge_count":6,"ecosystems":[{"ecosystem":"java","root_module":"com.app:app","function_count":1,"edge_count":6},{"ecosystem":"node","root_module":"","function_count":1,"edge_count":3}]},
  "finding_graphs": [
    {"finding_id":"8c4449c5","occurrence_key":"v1:615867f46dec4f4c","matched_operation":{"kind":"call","symbol":"com.app.Maker.finish","expression":"a.finish()","line":7},"supporting_call_ids":["f6290d45","f6d55eb9"],"call_chains":[[{"crypto_call":{"function_name":"com.app.Maker.finish","canonical_signature":"com.app.Maker.finish()","display_symbol":"com.app.Maker.finish","line":7}}]],"call_chain_indexes":[[0]],"reachable":false,"reachability":"unreachable","analysis":{"call_chains":"complete","parameters":"unavailable"}},
    {"finding_id":"f179c5a0","occurrence_key":"v1:6535f9194470d38b","matched_operation":{"kind":"call","symbol":"hash.digest","expression":"createHash('md5')","line":2},"supporting_call_ids":["20978909","4b11fb5d"],"call_chains":[[{"crypto_call":{"function_name":"hash.digest","canonical_signature":"hash.digest(?)","parameter_types":[""],"display_symbol":"hash.digest","line":2,"parameters":[{"parameter_index":0,"argument_expression":"\"hex\"","resolved_value":"\"hex\""}]}}]],"call_chain_indexes":[[1]],"reachable":false,"reachability":"unreachable","analysis":{"call_chains":"complete","parameters":"unavailable"}},
    {"finding_id":"0d37c729","occurrence_key":"v1:cd28a17ef9df18e3","matched_operation":{"kind":"call","expression":"MessageDigest.getInstance(\"SHA-1\")","line":3},"finding_location":{"file_path":"Report.kt","start_line":3,"end_line":3,"language":"kotlin"},"unresolved_reason":"language_not_analyzed","reachability":"not_applicable"}
  ],
  "functions": [
    {"function_key":"com.app.(Svc).run#0","function_name":"com.app.Svc.run","canonical_signature":"com.app.Svc.run(): void","return_type":"void","visibility":"package-private","owner_visibility":"package-private","display_symbol":"com.app.Svc.run","file_path":"Svc.java","start_line":4},
    {"function_key":"hash.h","function_name":"hash.h","canonical_signature":"hash.h(string)","parameter_types":["string"],"display_symbol":"hash.h","file_path":"hash.ts","start_line":2}
  ],
  "supporting_calls": [
    {"supporting_id":"20978909","function_key":"hash.h","function_name":"hash.h","canonical_signature":"hash.h(string)","erased_signature":"hash.h(string)","display_symbol":"hash.h","file_path":"hash.ts","start_line":2,"end_line":2,"matched_operation":{"kind":"call","symbol":"hash.update","expression":"createHash('md5').update","line":2},"supporting_call":{"function_name":"hash.update","canonical_signature":"hash.update(?)","parameter_types":[""],"display_symbol":"hash.update","line":2,"parameters":[{"parameter_index":0,"variable_name":"s","argument_expression":"s"}]}},
    {"supporting_id":"4b11fb5d","function_key":"hash.h","function_name":"hash.h","canonical_signature":"hash.h(string)","erased_signature":"hash.h(string)","display_symbol":"hash.h","file_path":"hash.ts","start_line":2,"end_line":2,"matched_operation":{"kind":"call","symbol":"crypto.createHash","expression":"createHash","line":2},"supporting_call":{"function_name":"crypto.createHash","canonical_signature":"crypto.createHash(?)","parameter_types":[""],"display_symbol":"crypto.createHash","line":2,"parameters":[{"parameter_index":0,"argument_expression":"\"md5\"","resolved_value":"\"md5\""}]}},
    {"supporting_id":"f6290d45","function_key":"com.app.(Svc).run#0","function_name":"com.app.Svc.run","canonical_signature":"com.app.Svc.run(): void","erased_signature":"com.app.Svc.run(): void","display_symbol":"com.app.Svc.run","file_path":"Svc.java","start_line":6,"end_line":6,"matched_operation":{"kind":"call","symbol":"com.app.Maker.configure","expression":"a.configure","line":6},"supporting_call":{"function_name":"com.app.Maker.configure","canonical_signature":"com.app.Maker.configure()","display_symbol":"com.app.Maker.configure","line":6}},
    {"supporting_id":"f6d55eb9","function_key":"com.app.(Svc).run#0","function_name":"com.app.Svc.run","canonical_signature":"com.app.Svc.run(): void","erased_signature":"com.app.Svc.run(): void","display_symbol":"com.app.Svc.run","file_path":"Svc.java","start_line":5,"end_line":5,"matched_operation":{"kind":"call","symbol":"com.app.Maker.<init>","display_symbol":"com.app.Maker.Maker","expression":"new Maker","line":5},"supporting_call":{"function_name":"com.app.Maker.<init>","canonical_signature":"com.app.Maker.<init>(): Maker","return_type":"Maker","display_symbol":"com.app.Maker.Maker","aliases":["com.app.Maker.Maker"],"line":5}}
  ]
}
